<!-- Small DTD for SURF based tools. -->
<!ELEMENT platform_description ((include|host|router|link)*,(include|route|process)*)>
<!ATTLIST platform_description version CDATA "0.0">

<!ELEMENT include EMPTY>
<!ATTLIST include file CDATA #REQUIRED>

<!ELEMENT host (prop*)>
<!ATTLIST host id CDATA #REQUIRED>
<!ATTLIST host power CDATA #REQUIRED>
<!ATTLIST host availability CDATA "1.0">
<!ATTLIST host availability_file CDATA "">
<!ATTLIST host state (ON|OFF) "ON">
<!ATTLIST host state_file CDATA "">
<!ATTLIST host interference_send CDATA "1.0">
<!ATTLIST host interference_recv CDATA "1.0">
<!ATTLIST host interference_send_recv CDATA "1.0">
<!ATTLIST host max_outgoing_rate CDATA "-1.0">

<!ELEMENT prop EMPTY>
<!ATTLIST prop id CDATA #REQUIRED>
<!ATTLIST prop value CDATA #REQUIRED>

<!ELEMENT router EMPTY>
<!ATTLIST router id CDATA #REQUIRED>

<!ELEMENT link (prop*)>
<!ATTLIST link id CDATA #REQUIRED>
<!ATTLIST link bandwidth CDATA  #REQUIRED>
<!ATTLIST link bandwidth_file CDATA "">
<!ATTLIST link latency CDATA "0.0">
<!ATTLIST link latency_file CDATA "">
<!ATTLIST link state (ON|OFF) "ON">
<!ATTLIST link state_file CDATA "">
<!ATTLIST link sharing_policy (SHARED|FATPIPE) "SHARED">

<!ELEMENT route (link:ctn*)>
<!ATTLIST route src CDATA #REQUIRED>
<!ATTLIST route dst CDATA #REQUIRED>
<!ATTLIST route impact_on_src CDATA "0.0">
<!ATTLIST route impact_on_dst CDATA "0.0">
<!ATTLIST route impact_on_src_with_other_recv CDATA "0.0">
<!ATTLIST route impact_on_dst_with_other_send CDATA "0.0">

<!ELEMENT link:ctn EMPTY>
<!ATTLIST link:ctn id CDATA #REQUIRED>

<!ELEMENT process ((argument|prop)*)>
<!ATTLIST process host CDATA #REQUIRED>
<!ATTLIST process function CDATA #REQUIRED>
<!ATTLIST process start_time CDATA "-1.0">
<!ATTLIST process kill_time CDATA "-1.0">

<!ELEMENT argument EMPTY>
<!ATTLIST argument value CDATA #REQUIRED>
