<?xml version='1.0'?>
<!DOCTYPE platform_description SYSTEM "surfxml.dtd">
<platform_description version="1">
  <process host="Jacquelin" function="server">
    <argument value="12345"/>
  </process>
  <process host="Boivin" function="client">
    <argument value="Jacquelin"/>
    <argument value="12345"/>
  </process>
  <process host="Geoff" function="client">
    <argument value="Jacquelin"/>
    <argument value="12345"/>
  </process>
</platform_description>

