<?xml version='1.0'?>
<!DOCTYPE platform_description SYSTEM "surfxml.dtd">
<platform_description>
  <!-- The Tremblay node, arguments :: all others nodes -->
  <process host="Tremblay" function="sender">
     <argument value="4000"/>
     <argument value="Jupiter"/>  
     <argument value="Fafard"/> 
     <argument value="Ginette"/> 
     <argument value="Bourassa"/> 
  </process>
  <!-- The Jupiter node, arguments :: all others nodes -->
  <process host="Jupiter" function="sender">
     <argument value="4000"/>
     <argument value="Tremblay"/> 
     <argument value="Fafard"/> 
     <argument value="Ginette"/> 
     <argument value="Bourassa"/> 
  </process>
  <!-- The Fafard node, arguments :: all others nodes -->
  <process host="Fafard" function="sender">
     <argument value="4000"/>
     <argument value="Tremblay"/> 
     <argument value="Jupiter"/>  
     <argument value="Ginette"/> 
     <argument value="Bourassa"/> 
  </process>
  <!-- The Ginette node, arguments :: all others nodes -->
  <process host="Ginette" function="sender">
     <argument value="4000"/>
     <argument value="Tremblay"/> 
     <argument value="Jupiter"/>  
     <argument value="Fafard"/> 
     <argument value="Bourassa"/> 
  </process>
  <!-- The Bourassa node, arguments :: all others nodes -->
  <process host="Bourassa" function="sender">
     <argument value="4000"/>
     <argument value="Tremblay"/> 
     <argument value="Jupiter"/>  
     <argument value="Fafard"/> 
     <argument value="Ginette"/> 
  </process>
  
  
  <process host="Tremblay" function="receiver">
     <argument value="4000"/>
     <argument value="4"/>  
  </process>
  <process host="Jupiter" function="receiver">
     <argument value="4000"/>
     <argument value="4"/>
  </process>
  <process host="Fafard" function="receiver">
     <argument value="4000"/>
     <argument value="4"/> 
  </process>
  <process host="Ginette" function="receiver">
     <argument value="4000"/>
     <argument value="4"/>
  </process>
  <process host="Bourassa" function="receiver">
     <argument value="4000"/>
     <argument value="4"/>
  </process>
</platform_description>
